{
  "version": 1,
  "defaultView": "table",
  "theme": "system",
  "density": "comfortable",
  "table": {
    "groupBy": "displayGroup",
    "sortGroups": "countDesc",
    "stickyGroupHeader": true,
    "actionBar": "selection-bar"
  },
  "actions": {
    "placements": ["row-menu", "group-header", "selection-bar", "detail-footer"],
    "confirmBulk": true,
    "commentPresets": ["同意", "已核对，同意", "请补充信息"]
  },
  "navigation": {
    "preserveQueryOnViewSwitch": true,
    "openExternalBill": "new-tab"
  },
  "attachments": {
    "iconStyle": "type-badge"
  },
  "appearance": {
    "background": {
      "enabled": false,
      "imageUrl": "",
      "fit": "cover",
      "position": "center",
      "attachment": "fixed",
      "dim": 0.42,
      "blur": 0,
      "saturate": 0.9,
      "panelOpacity": 0.96
    }
  }
}
